### ISSUE TITLE
API methods of doing this within code?

### ISSUE THREAD

**Issue by 1Dragoon** [MicrosoftDocs/windowsserverdocs#6295]
[Enter feedback here]

I've read that robocopy and xcopy can ask the win32 api to enable SMB compression when copying a particular file, without needing to modify any global system settings or even smb session settings. I don't see this documented anywhere in the win32 api though, so I'm not sure how to do it in my own code. Can somebody point me in the right direction? Based on the description of robocopy, it is able to request it on the fly, so I figure there must be an API call somewhere.

---
#### Document Details

⚠ *Do not edit this section. It is required for docs.microsoft.com ➟ GitHub issue linking.*

* ID: 92e39b63-db66-7c78-aa3e-a8c74cacac08
* Version Independent ID: f57abd0f-7547-e178-cb9c-672fc029e919
* Content: [SMB Compression](https://docs.microsoft.com/en-us/windows-server/storage/file-server/smb-compression)
* Content Source: [WindowsServerDocs/storage/file-server/smb-compression.md](https://github.com/MicrosoftDocs/windowsserverdocs/blob/main/WindowsServerDocs/storage/file-server/smb-compression.md)
* Product: **windows-server**
* Technology: **storage**
* GitHub Login: @nedpyle
* Microsoft Alias: **inhenkel**

**Comment by nedpyle** [comment]
HI @1Dragoon, sorry for the delay - I was taking the time to update all the API docs and they published yesterday. :)

https://docs.microsoft.com/en-us/windows/win32/api/winbase/nf-winbase-copyfileexw
https://docs.microsoft.com/en-us/windows/win32/api/winbase/nf-winbase-copyfileexa

The same applies to CopyFile2 although that one hasn't published yest for some reason (at least in my region)

Thanks very much for sending this feedback, it had simply slipped through the cracks. You did everyone a service!

- Ned Pyle
SMB team

**Comment by 1Dragoon** [comment]
Awesome, thanks!

By the way, on the topic of SMB transfers, I've found that I can get really good performance doing a thread-pooled directory traversal when copying big nested folders with many small files, followed by another thread-pooled copy of each individual file. In my test I'm able to copy an entire ~10,000 file, ~750MB directory tree across a 200mbit VPN link before the windows file explorer even finishes doing a directory scan (and it estimates an hour to actually copy everything after that.)

Some (unfinished but working) code here: https://github.com/1Dragoon/fcp

I'm still using the same api that I believe file explorer uses with my approach. I think it would be nice, for convenience sake, if the file explorer adopted a similar approach. I could see why they wouldn't have done it in the past, namely because it would cause HDDs to do a lot of thrashing and quite possibly result in reduced performance. But now we're in an era where SSDs and multi-core CPUs are the rule rather than the exception, so it might be worth them doing now. I'm actually doing this on a relatively low spec, four year old laptop (quad core, and just a run-of-the-mill SSD.)

It seemed to do it even faster than robocopy as well, but I think that may come from my directory traversal approach, as I think robocopy might be doing that with just one thread.

Who would I bring this suggestion to?

**Comment by nedpyle** [comment]
Hi @1Dragoon. I'd recommend using the Windows Feedback Hub tool for both.

**Comment by 1Dragoon** [comment]
Just one more question, what method does Microsoft recommend for determining whether the OS supports the transport compression feature?

**Comment by nedpyle** [comment]
It's part of the SMB supported compatibilities negotiation made during SMB NEG, as IsCompressionSupported. https://docs.microsoft.com/en-us/openspecs/windows_protocols/ms-smb2/c79ff63c-871a-49d6-9940-cabdf5f3f4e2. On the wire it will look like:

Frame 1270: 334 bytes on wire (2672 bits), 334 bytes captured (2672 bits) on interface \Device\NPF_{E5A28698-A81C-470D-8676-64874DC74F6A}, id 0
Ethernet II, Src: AristaNe_72:90:5d (28:99:3a:72:90:5d), Dst: HewlettP_02:e1:66 (1c:c1:de:02:e1:66)
Internet Protocol Version 4, Src: 10.91.192.103, Dst: 10.231.84.11
Transmission Control Protocol, Src Port: 11700, Dst Port: 445, Seq: 74, Ack: 253, Len: 280
NetBIOS Session Service
SMB2 (Server Message Block Protocol version 2)
    SMB2 Header
    Negotiate Protocol Request (0x00)
        [Preauth Hash: 9e16154dbceb2f6c0258034a3df7d1a0ad6ea7c816daaee3fd4faa249f6a9abbc73e96cd…]
        StructureSize: 0x0024
        Dialect count: 5
        Security mode: 0x01, Signing enabled
        Reserved: 0000
        Capabilities: 0x0000007f, DFS, LEASING, LARGE MTU, MULTI CHANNEL, PERSISTENT HANDLES, DIRECTORY LEASING, ENCRYPTION
        Client Guid: 957b473b-a383-11ec-a292-c8348e099895
        NegotiateContextOffset: 0x00000070
        NegotiateContextCount: 6
        Reserved: 0000
        Dialect: SMB 2.0.2 (0x0202)
        Dialect: SMB 2.1 (0x0210)
        Dialect: SMB 3.0 (0x0300)
        Dialect: SMB 3.0.2 (0x0302)
        Dialect: SMB 3.1.1 (0x0311)
        Negotiate Context: SMB2_PREAUTH_INTEGRITY_CAPABILITIES 
        Negotiate Context: SMB2_ENCRYPTION_CAPABILITIES 
        Negotiate Context: SMB2_COMPRESSION_CAPABILITIES 
            Type: SMB2_COMPRESSION_CAPABILITIES (0x0003)
            DataLength: 16
            Reserved: 00000000
            CompressionAlgorithmCount: 4
            Flags: 0x00000001, Chained
            CompressionAlgorithmId: Pattern_V1 (0x0004)
            CompressionAlgorithmId: LZ77 (0x0002)
            CompressionAlgorithmId: LZ77+Huffman (0x0003)
            CompressionAlgorithmId: LZNT1 (0x0001)
        Negotiate Context: SMB2_SIGNING_CAPABILITIES 
        Negotiate Context: SMB2_NETNAME_NEGOTIATE_CONTEXT_ID 
        Negotiate Context: SMB2_RDMA_TRANSFORM_CAPABILITIES 

Frame 1270: 334 bytes on wire (2672 bits), 334 bytes captured (2672 bits) on interface \Device\NPF_{E5A28698-A81C-470D-8676-64874DC74F6A}, id 0
Ethernet II, Src: AristaNe_72:90:5d (28:99:3a:72:90:5d), Dst: HewlettP_02:e1:66 (1c:c1:de:02:e1:66)
Internet Protocol Version 4, Src: 10.91.192.103, Dst: 10.231.84.11
Transmission Control Protocol, Src Port: 11700, Dst Port: 445, Seq: 74, Ack: 253, Len: 280
NetBIOS Session Service
SMB2 (Server Message Block Protocol version 2)
    SMB2 Header
    Negotiate Protocol Request (0x00)
        [Preauth Hash: 9e16154dbceb2f6c0258034a3df7d1a0ad6ea7c816daaee3fd4faa249f6a9abbc73e96cd…]
        StructureSize: 0x0024
        Dialect count: 5
        Security mode: 0x01, Signing enabled
        Reserved: 0000
        Capabilities: 0x0000007f, DFS, LEASING, LARGE MTU, MULTI CHANNEL, PERSISTENT HANDLES, DIRECTORY LEASING, ENCRYPTION
        Client Guid: 957b473b-a383-11ec-a292-c8348e099895
        NegotiateContextOffset: 0x00000070
        NegotiateContextCount: 6
        Reserved: 0000
        Dialect: SMB 2.0.2 (0x0202)
        Dialect: SMB 2.1 (0x0210)
        Dialect: SMB 3.0 (0x0300)
        Dialect: SMB 3.0.2 (0x0302)
        Dialect: SMB 3.1.1 (0x0311)
        Negotiate Context: SMB2_PREAUTH_INTEGRITY_CAPABILITIES 
        Negotiate Context: SMB2_ENCRYPTION_CAPABILITIES 
        Negotiate Context: SMB2_COMPRESSION_CAPABILITIES 
            Type: SMB2_COMPRESSION_CAPABILITIES (0x0003)
            DataLength: 16
            Reserved: 00000000
            CompressionAlgorithmCount: 4
            Flags: 0x00000001, Chained
            CompressionAlgorithmId: Pattern_V1 (0x0004)
            CompressionAlgorithmId: LZ77 (0x0002)
            CompressionAlgorithmId: LZ77+Huffman (0x0003)
            CompressionAlgorithmId: LZNT1 (0x0001)
        Negotiate Context: SMB2_SIGNING_CAPABILITIES 
        Negotiate Context: SMB2_NETNAME_NEGOTIATE_CONTEXT_ID 
        Negotiate Context: SMB2_RDMA_TRANSFORM_CAPABILITIES 

Frame 1271: 430 bytes on wire (3440 bits), 430 bytes captured (3440 bits) on interface \Device\NPF_{E5A28698-A81C-470D-8676-64874DC74F6A}, id 0
Ethernet II, Src: HewlettP_02:e1:66 (1c:c1:de:02:e1:66), Dst: a2:00:82:03:03:01 (a2:00:82:03:03:01)
Internet Protocol Version 4, Src: 10.231.84.11, Dst: 10.91.192.103
Transmission Control Protocol, Src Port: 445, Dst Port: 11700, Seq: 253, Ack: 354, Len: 376
NetBIOS Session Service
SMB2 (Server Message Block Protocol version 2)
    SMB2 Header
    Negotiate Protocol Response (0x00)
        [Preauth Hash: c7b14997afcff0df86b620006b787ef1e2cfde4ea4e956170cd27125332e850cacba03f2…]
        StructureSize: 0x0041
        Security mode: 0x01, Signing enabled
        Dialect: SMB 3.1.1 (0x0311)
        NegotiateContextCount: 5
        Server Guid: 79c49a34-38a8-4c53-84cf-374c0d7481ba
        Capabilities: 0x0000003f, DFS, LEASING, LARGE MTU, MULTI CHANNEL, PERSISTENT HANDLES, DIRECTORY LEASING
        Max Transaction Size: 8388608
        Max Read Size: 8388608
        Max Write Size: 8388608
        Current Time: Mar 14, 2022 14:50:45.055254100 Pacific Daylight Time
        Boot Time: No time specified (0)
        Blob Offset: 0x00000080
        Blob Length: 120
        Security Blob: 607606062b0601050502a06c306aa03c303a060a2b06010401823702021e06092a864882…
        NegotiateContextOffset: 0x000000f8
        Negotiate Context: SMB2_PREAUTH_INTEGRITY_CAPABILITIES 
        Negotiate Context: SMB2_ENCRYPTION_CAPABILITIES 
        Negotiate Context: SMB2_SIGNING_CAPABILITIES 
        Negotiate Context: SMB2_RDMA_TRANSFORM_CAPABILITIES 
        Negotiate Context: SMB2_COMPRESSION_CAPABILITIES 
            Type: SMB2_COMPRESSION_CAPABILITIES (0x0003)
            DataLength: 12
            Reserved: 00000000
            CompressionAlgorithmCount: 2
            Flags: 0x00000001, Chained
            CompressionAlgorithmId: LZ77 (0x0002)
            CompressionAlgorithmId: Pattern_V1 (0x0004)

**Comment by 1Dragoon** [comment]
Sorry I should clarify - I meant what does Microsoft recommend for checking that the windows OS itself will accept the COPY_FILE_REQUEST_COMPRESSED_TRAFFIC flag. It returns an error condition on Windows Server 2019 if I attempt to pass that flag, which is expected based on the documentation, which states that you need Windows Server 2022 or later. But I don't know what API call Microsoft recommends you make to determine that this feature is available. For example, should it be some sort of version check against the OS, or is there another way to probe for which flags will be accepted?

Thanks for that info you just provided though, that will help a lot for debugging

**Comment by nedpyle** [comment]
There's no API call, it's just utilizing the nature of negotiation. Compression is requested but guaranteed, so the caller needs to not fail if they request compression and it doesn't actually occur. Robocopy tries to compress and hopes it works out, but there will be no error to user if the server is 2008, for instance.

**Comment by 1Dragoon** [comment]
Just to clarify further, I mean if I try to make the win32 API call with the COPY_FILE_REQUEST_COMPRESSED_TRAFFIC enum in CopyFileExW on an older windows computer (like when I tried to run it on Windows Server 2019) it returns a non-zero result meaning, according to the documentation, the copy didn't actually run, and following the documentation said to use GetLastError, which returns error code 87, which I understand to mean there was an input parameter error. In other words, Windows Server 2019's win32 API will fail if I try to set a flag which it doesn't recognize.

Is there any kind of API call I should make to ensure that the OS I'm running this on will accept the COPY_FILE_REQUEST_COMPRESSED_TRAFFIC enum?

**Comment by Xelu86** [comment]
#assign:xelu86

**Comment by Xelu86** [comment]
Hey @1Dragoon,

Thank you for your inquiry. As we understand it, you're describing a non-issue with the documentation. GitHub isn't quite the right location or channel if searching for technical support, deeper specifics of a product or feature requests as it is outside our scope. If there are any issues within the content itself, such as incorrect code, verbiage, etc., please let us know.

We suggest posting this question in our support forums listed below:
- TechNet: https://social.technet.microsoft.com/Forums/en-US/home
- MSDN: https://social.msdn.microsoft.com/Forums/en-US/home
- Microsoft Community: https://answers.microsoft.com/

Hopefully one of the community experts may be able to better assist. We will now be closing this thread. Thank you and have a most pleasant day. 
#please-close
